hallazgo_id,plan_id,auditor,name_hallazgo,capitulo,dependencia,descripcion,causa,efecto
112,15,krcuellard,1.8,AUDITORÍA INTERNA      ,IDEXUD,"Incumplimiento del parágrafo 1 de la Circular DDT No. 5 de febrero de 2018,que establece la responsabilidad de las entidades y los servidores públicos donde indica “ les corresponde el deber de garantizar la seguridad y control de los recursos del patrimonio distrital, la adecuada gestión de riesgos y la aplicación de controles preventivos” corresponde a la Administración efectuar la gestión para solicitar una póliza de cobertura de Infidelidad y Riesgos Financieros (IRF) con el objetivo de proteger los recursos administrados por el IDEXUD: Hasta la fecha, no se ha procedido con la gestión correspondiente para obtener la póliza que resguarde los recursos a cargo del IDEXUD.","la oficina de Extensión es una dependencia de la universidad Distrital, por lo tanto funge bajo el mismo NIT, situación que ha impedido que se genere un nuevo contrato que ampare los recursos debido a que el contrato actual cubre los recursos de la universidad.",
113,15,krcuellard,2.1,AUDITORÍA INTERNA      ,IDEXUD,"Falta de control en la apertura  cuentas corrientes: Incumplimiento  al 'Instructivo para la Apertura de  Cuentas Bancarias', revela una  carencia en el control de la  autorización para la apertura.  Conforme al PROCEDIMIENTO EPSPR-005, APERTURA FINANCIERA'. El procedimiento EPS-PR-005  APERTURA FINANCIERA, pertenece  como lo registra SIGUD a (Extensión y  Proyección social) IDEXUD y no se  evidencia el paso que indique la revisión  y firma del procedimiento por parte del  director del IDEXUD o del ordenador del  gasto o quien haga sus veces, como lo   estipula el INSTRUCTIVO APERTURA  DE CUENTAS BANCARIAS enviado por parte del IDEXUD, según oficio No.  IE-20894-2023 ","El instructivo Código GRF-IN002 INSTRUCTIVO APERTURA DE  CUENTAS BANCARIAS, es la Versión 1 del documento, y cuando se proyectó no quedó en el mismo, el paso que efectivamente se realiza en torno a la firma que deben llevar las solicitudes de apertura de nuevos productos bancarios.",
114,15,krcuellard,2.2,AUDITORÍA INTERNA      ,IDEXUD,"Apertura de cuentas bancarias direccionadas a un solo banco: El GRF-IN-002 INSTRUCTIVO APERTURA CUENTAS BANCARIAS enviado mediante el oficio No. IE- 20894-2023 se encuentra solamente bajo la el control y funcionalidad del director del IDEXUD. Identificando que el proceso se direcciona a solo un banco, exclusivamente en este caso Banco Occidente","El instructivo Código GRF-IN002 INSTRUCTIVO APERTURA DE  CUENTAS BANCARIAS, es la Versión 1 del documento, y cuando se proyectó  se llevó de manera literal al proceso que actualmente se tiene establecido, dado que la oficina de Extensión en pro de optimizar recursos reduciendo los Gastos financieros, optó por manejar sus productos en Banco de Occidente.",
115,15,krcuellard,2.3,AUDITORÍA INTERNA      ,IDEXUD,"Falta de control en la elaboración del boletín diario de caja y bancos a fin de conocer el flujo de efectivo de todas las cuentas bancarias por parte del IDEXUD y Tesorería Principal: Se identifica que sí se presentaron inconsistencias en la información recibida de acuerdo a la respuesta enviada en el documento IE-21864-2023 con fecha del 24 de noviembre de 2023, debido a que no se incluyeron los boletines diarios de efectivo y bancos en dicha información, y la información no fue enviada oportunamente, de manera clara y precisa en los tiempos estipulados por la Oficina de Control Interno.","El evento que comprometió la seguridad informática de la universidad Distrital, afectó la información que se tenía en ese momento en carpetas compartidas, puntualmente los equipos asignados a tesorería fueron afectados de modo mucha información debió reconstruirse, confidencialmente al momento de la auditoría la Oficina de Extensión se encontraba en ese proceso, situación que terminó en la demora de la entrega de la información dado los eventos relatados.",
116,15,krcuellard,2.4,AUDITORÍA INTERNA      ,IDEXUD,"Incumplimiento en el procedimiento y la elaboración de las conciliaciones bancarias de IDEXUD. Se identifica que sí se presentaron inconsistencias en la información recibida, de acuerdo a la respuesta enviada en el documento OF-504-2023 con fecha del 26 de octubre de 2023, debido a que la división financiera sugirió que se realizara dicha solicitud directamente al Instituto de Extensión de la Universidad Distrital, sin embargo, la dependencia encargada para el envío de las conciliaciones bancarias debidamente firmadas y realizadas de acuerdo al procedimiento GR-PR-010 ELABORACIÓN DE LA CONCILIACIÓN Y DEPURACIÓN DE LA CONCILIACIÓN es la Unidad de Contabilidad, y la información no fue enviada oportunamente, de manera clara y precisa en los tiempos estipulados por la Oficina de Control Interno.","En marco de la Auditoria se entrego por parte del equipo de la Oficina de Extensión Información que por Competencia es de la Sección de contabilidad en donde reposan las conciliaciones Aprobadas con la completitud de Firmas, Induciendo a un error al equipo Auditor de Control Interno ",
117,16,cgutmang,1.1.,AUDITORÍA INTERNA      ,VAF,Hallazgo de la oficina de contratacion por no tiene identificado el tratamiento de riesgos en la matriz integral de riesgos.,"la oficina de contratacion no existia en el momento que la OAP emitió las directrices para la formulación de riesgos 2023.
Se aclara que el Manual de Gestión para la Administración del Riesgo de la Universidad Distrital no establece periodicidad de actualización, por otro lado, se generará la mesa de trabajo con las unidades responsables para la identificación de actividades de tratamiento al riesgo de acuerdo a lo solicitado. ",
118,16,cgutmang,2.1,AUDITORÍA INTERNA      ,VAF,Hallazgo desactualización de la caracterización del proceso gestion contractual,"La caracterización del Proceso es el último documento que se actualiza puesto que esta refleja todo el Proceso, durante el trabajo realizado el año pasado quedó pendiente de actualizar y se actualizara una vez se defina el alcance de la Oficina de Contratación.",
119,16,cgutmang,3.1,AUDITORÍA INTERNA      ,VAF,"Hallazgo, por el no seguimiento de los indicadores del proceso de gestion contractual conforme a la hoja de vida.","El ejercicio de reporte es liderado por el SIGUD, quienes dan los lineamientos y terminos para el reporte de esos indicadores. Por lo anterior se presenta la falta de Digitalización de resultados logrados en cada indicador",
120,16,cgutmang,4.1,AUDITORÍA INTERNA      ,VAF,"Hallazgo por incumplimiento en la ejecución del procedimiento gc-pr-001 ""plan anual de adquisiciones."" ",En ocaciones no se hace necesario tener un documento especifico por parte de la Unidad responsable de la formulación del estudio de conveniencia y oportunidad,
121,16,cgutmang,4.2,AUDITORÍA INTERNA      ,VAF,Hallazgo no publicación en el secop las acualizaciones del plan anual de adquisiciones.,"Los archivos a adjuntar son muy pesados, lo que dificulta el cargue en la plataforma según lo parametros establecidos",
122,16,cgutmang,5.1,AUDITORÍA INTERNA      ,OAJ,Hallazgo por el no cargue de la informacion en la pagina web.,"Creacion de la nueva Oficna de Comtratacion y la falta de pagina web de la oficina para consolidar la publicación de la información correspondiente.
La base se datos remitida se actualiza diariamente y por esta razon se puede presentar variacion en los datos.",
123,16,cgutmang,5.2,AUDITORÍA INTERNA      ,OAJ,Hallazgo con respecto al cargue de la informacion en la plataforma secop ii.,Demora en el cargue de la información por parte de los dependencias responsables,
124,16,cgutmang,5.2,AUDITORÍA INTERNA      ,OAJ,Hallazgo con respecto al cargue de la informacion en la plataforma secop ii.,Demora en el cargue de la información por parte de los dependencias responsables,
125,16,cgutmang,5.3,AUDITORÍA INTERNA      ,OAJ,"Hallazgo con respecto a las incosistencias presentadas en
el acta de incio de los contratos de prestacion de servicios",Fallas en sistemas y pataformas tecnologicas por el hakeo que presentó la universidad. Por lo anterio se presnetaron modificaciones en los datos,
126,16,cgutmang,6.1,AUDITORÍA INTERNA      ,OAJ,Hallazgo por el no reporte de la informacion en la pagina web de la contratacion directa.,"Creacion de la nueva Oficna de Comtratacion y la falta de pagina web de la oficina para consolidar la publicación de la información correspondiente.
La base se datos remitida se actualiza diariamente y por esta razon se puede presentar variacion en los datos.",
127,16,cgutmang,8.1,AUDITORÍA INTERNA      ,VAF,Hallazgo por la ausencia de evaluación de proveedores.,Falta de gestion de los supervisores de contrato,
128,16,cgutmang,12.1,AUDITORÍA INTERNA      ,OAJ,Hallazgo no contar con el concepto emitido por la oficina asesora de planeacion para la suscripcion de los contratos de arrendamiento.,Fata de remision de la información a la OCI,
129,16,cgutmang,12.2,AUDITORÍA INTERNA      ,VAF,Hallazgo: incumplimiento en el carga de informes de supervisión en procesos contractuales,Falta de gestion de los supervisores de contrato,
130,16,cgutmang,13.1,AUDITORÍA INTERNA      ,VAF,Hallazgo por la no actualizacion del procedimiento adoptando la normatividad vigente.,La VAF remitio a SIGUD medinete acta los ajuste del procedimiento el cual se encuetra en tramite de actualización.,
131,16,cgutmang,14,AUDITORÍA INTERNA      ,VAF,Hallazgo por el no envio de informacion requerida,Debido a la cantidad de solicitudes que llegan a la VAF se dificulta cumplir con algunas solicitudes,
132,17,jeguzmang,1.1.1,AUDITORÍA INTERNA      ,SGSST,"Falta de revisión, modificación y actualización, así como desorden e irregular gestión documental de forma general, de los registros o documentos del Proceso GDTH y en el SG-SST en la página web; donde se evidencia lo anterior, y observándose como último año de revisión en él 2017. Se aclara que el Subsistema ha venido trabajando en este aspecto, pero hacia el SIGUD no se identifica este mismo actuar, de acuerdo a las evidencias encontradas.","Porque el proceso de aprobaciòn y publicaciòn corresponde al SIGUD, porque el SIGUD es el encargado de la revisiòn documental en la Universidad Distrital, porque esta establecido que el SIGUD publicar y comunica los documentos, procesos y procedimientos, que ya han sido aprobados, los deben estar publicados pagina web por SIGUD.",
133,17,jeguzmang,1.1.2,AUDITORÍA INTERNA      ,SGSST,"Realizada la revisión a los registros del Normograma del ProcesoGDTH y en el SG-SST se evidencia que este no se actualiza desde el mes de diciembre de 2019, encontrándose normatividad derogada y ausencia de las nuevas normas, tanto internas como externas aplicables al Proceso. Así mismo, se observan Resoluciones de Rectoría duplicadas, como por ejemplo la Resolución 562 del 09 de octubre de 2023 y la 578 del 18 de octubre del mismo año, que contienen el mismo acto administrativo referente al PESV.","Porque en el momoento de la revisiòn del normograma el auditor se baso en la evidencia que se encontraba en la pagina web, no obstante se le dio a conocer el acutializdo en 2023, lo que el auditor no tuvo encuenta en el informe. Por el auditor dentro el proceso de auditorìa no especifica que normas no se en contraron en el normograma para establecer el incumplimiento de algùn requisito en especifico. Que la""duplicidad"" no es validada ya que la ùnicaresoluciòn de politica del PESV aprobada y firmada es la 578 del 18 de octubrre de 2023",
134,17,jeguzmang,2.1.1,AUDITORÍA INTERNA      ,SGSST,"No se evidencia el documento o el protocolo de operación y mantenimiento de las vías públicas y privadas que tiene a cargo, que administra o que controla directamente al servicio de la Universidad.",Por que en el momento de revsion de PESV al auditor se le presentò  el protocolo establecido para vìas internas e informes de inspeciones de vias internas y parqueaderos intenos- que noy inclumplimiento del paso 14 del PESV,
135,17,jeguzmang,2.1.2,AUDITORÍA INTERNA      ,SGSST,No se evidencia el diseño e implementación de un plan de mantenimiento preventivo para vehículos automotores y no automotores utilizados para los desplazamientos laborales al servicio de la Entidad.,"Que para el punto auditado el SGSST documentò  un procedimiento y formatos para el mantenimiento preventivo de vehiculos de la instiutcion y se difundiò al area de Infraestructura, que al auditor se le presentò el acta que hace constar que a area encargada se le hizo la socializaciòn, ",
136,17,jeguzmang,2.1.3,AUDITORÍA INTERNA      ,SGSST,"Al solicitar a la Entidad los soporte y/o pruebas de la documentación y elaboración de la hoja de vida de cada vehículoautomotor y no automotor que se utilizan, estas no fueron aportadas, lo que se considera como un incumplimiento al requisito anteriormente citado.","La Oficina de Infraestructura se encontraba en la organizaciòn documental para la fecha que se realiza la auditorìa, al igual es deconocimiento del auditor de los documentos que soportan esta solicitud, y por lo tanto no se lograron presentar al auditor, cabea clarar que el SGSST difundió a la Oficina de Infraestructura los documentos establecidos en el PESV, para su ejecución y el protocolo de mantenimientos.",
137,17,jeguzmang,2.1.4,AUDITORÍA INTERNA      ,SGSST,"No se evidencia el mantenimiento de los vehículos de propiedad de los colaboradores puestos al servicio de la organización, para el cumplimiento de sus funciones al servicio de la Entidad.","PorquealSGSSTnoseleinformabaquelaUniversidadcontratabaesteservicotercerizado,loquedificultabatenerestainformación,desdeaños anteriores.",
138,17,jeguzmang,2.1.5,AUDITORÍA INTERNA      ,SGSST,"Falta de modificación y actualización del Plan Estratégicos de Seguridad Vial – PESV en la Universidad Distrital, con la nueva normatividad al respecto, de los registros o documentos del Proceso GDTH y en el SG-SST en la página web; ya que se evidencia lo anterior y observándose uno, del periodo 2018-2020, como último año de revisión. Se aclara que el Subsistema ha venido trabajando en este aspecto, pero hacia el SIGUD no se identifica este mismo actuar, de acuerdo con las evidencias encontradas.",Que se tiene estbalecido  un manual  que recopila todos los asptectos del PESV en el nivel bàsico que aplica para la Universida distrital el cual està actualizado con la resoluciòn 40595 del PESV el cual està en proceso de revision y aprobacion del SIGUD. Que por tartase de un nivel basico suficiente con un documentos que evidendice la implementaciòn.,
139,17,jeguzmang,3.1.1,AUDITORÍA INTERNA      ,SGSST,"No se evidencia un acto administrativo que adopte el PROGRAMA PARA LA REHABILITACIÓN Y REINCORPORACIÓN LABORAL DE LOS TRABAJADORES DE LA UNIVERSIDAD DISTRITAL FRANCISCO JOSÉ DE CALDAS, por lo cual estaría configurando el hallazgo; al ir en contravía con la Resolución 3050.","En el momento de enviar la solicitud al SIGUD por error técnico no se adjunto el procedimiento GI-PR-005,ni la guia  GI-GUI-001, documentos que debieron anexarse al programa de Rehabilitación y Reincorporación Laboral. El programa en mención esta anclado al PVE de Medicina Preventiva, que ya esta radicado ante el SIGUD.",
140,17,jeguzmang,3.1.2,AUDITORÍA INTERNA      ,SGSST,"El Programa de Rehabilitación Integral para la Reincorporación Laboral y Ocupacional para la Población Afiliada al Sistema General de Riesgos Laborales en la Universidad, se identifica que está en proceso de construcción, ya que tanto en las páginas institucionales del Proceso de GDTH como en el del SG-SST no se evidencia,ni hay registros; así mismo no se ha normalizado ni ha sido aprobado en el SIGUD, configurándose lo anterior en un hallazgo.","En el momento de enviar la solicitud al SIGUD por error técnico no se adjunto el procedimiento GI-PR-005,ni la guia  GI-GUI-001, documentos que debieron anexarse al programa de Rehabilitación y Reincorporación Laboral. El programa en mención esta anclado al PVE de Medicina Preventiva, que ya esta radicado ante el SIGUD.",
141,18,joaramirezt,2.2.1,AUDITORÍA INTERNA      ,IPAZUD,Hallazgo por no actualización de la normatividad interna,Desactualización de la normatividad ,
142,18,joaramirezt,2.3.1,AUDITORÍA INTERNA      ,IPAZUD,"Hallazgo por inexistencia del acto administrativo u otro documento oficial de integración del consejo directivo del IPAZUD, e inexistencia del reglamento por el cual se debería regir",No se realizó la designación o integración del consejo directivo por acto administrativo y no se ha realizado el reglamento del consejo,
143,18,joaramirezt,2.3.2,AUDITORÍA INTERNA      ,IPAZUD,Hallazgo por incumplimiento a las reuniones bimensuales por parte del consejo directivo del IPAZUD,Falta de quorum ,
144,18,joaramirezt,2.4.1,AUDITORÍA INTERNA      ,IPAZUD,Hallazgo por no uso de documentos controlados en el SIGUD,Falta de verificación de los formatos establecidos en el SIGUD ,
145,18,joaramirezt,2.5.1,AUDITORÍA INTERNA      ,IPAZUD,Hallazgo por incumplimiento a las etapas establecidas dentro de los procedimientos,Desactualización del flujograma y desconocimiento del procedimiento ,
146,18,joaramirezt,2.6.1,AUDITORÍA INTERNA      ,IPAZUD,Hallazgo por incumplimiento a la obligación de publicar en el SECOP II la información contractual,No se realiza la verificación de los documentos del area administrativa ,
147,18,joaramirezt,2.6.2,AUDITORÍA INTERNA      ,IPAZUD,Hallazgo por deficiencias en la supervisión de las actividades desarrolladas por los contratistas del IPAZUD,No se realiza la supervisión adecuada ,
148,18,joaramirezt,2.7.1,AUDITORÍA INTERNA      ,IPAZUD,Hallazgo por incumplimiento a la ejecución presupuestal,Falta de revisión de la ejecución del presupuesto ,
149,18,joaramirezt,2.7.2,AUDITORÍA INTERNA      ,IPAZUD,Hallazgo por falta de control y conciliación en la información suministrada por el IPAZUD y la unidad de presupuesto con respecto a la ejecución,Falta de conciliación con la Unidad de presupuesto ,
150,19,yxsanchezc,2.1.1,AUDITORÍA INTERNA      ,I3+,Hallazgo por no Soportar que Gestión han Realizado para la Normalización de la Documentación,No se ha realizado la gestión correspondiente por parte del Instituto I3+ para la actualización de la documentación.,
151,19,yxsanchezc,2.2.1,AUDITORÍA INTERNA      ,I3+,Hallazgo no se Evidencia las Modificaciones del Artículo 3 del Acuerdo 013 De 2018 para poner en Marcha El I3+,Si bien se han venido realizando las gestiones por parte del Instituto no se ha obtenido respuesta por parte de las diferentes estancias. ,
152,19,yxsanchezc,2.3.1,AUDITORÍA INTERNA      ,I3+,"Hallazgo por no Reportar los Informes de la supervisión Realizada A Los Convenios, SMEG-038-2022, Convenio De cooperación De Ciencia y Tecnología 914-2022 y el de Ciencia y Tecnología 572-2023",La respuesta no se contesto dentro de los plazos establecidos debido a que el I3+ cuenta solo con un contratista (Insuficiencia del equipo del I3+),
153,19,yxsanchezc,2.4.1,AUDITORÍA INTERNA      ,I3+,"Hallazgo por el no soporte de las certificaciones bancarias, extractos y soportes de reintegro de rendimientos financieros",La información se carga a medida que los bancos remiten la información lo cual no lo hicieron siempre de manera oportuna. ,
154,19,yxsanchezc,2.5.1,AUDITORÍA INTERNA      ,I3+,Hallazgo Por No Publicar En La Página Web Del I3+ Los Informes de Gestión y las Actas y Registros del Consejo Del Instituto.,Por fallas del servidor de la universidad no se conto con disponibilidad de la pag web hasta tanto se solicito a RITA la reactivación de la Pagina ,
155,19,yxsanchezc,2.6.1,AUDITORÍA INTERNA      ,I3+,Hallazgo Por No Reportar las Gestiones Realizadas Antes Las Directivas Para La suscripción De La póliza,"Si bien se han venido adelantando gestiones orientadas a la solicitud de dineros en administración de terceros por la suscrición de convenios y/o contratos administrativos, nunca fue aprobada la solicitud. 

La finalidad de la póliza es garantizar el manejo adecuado de los fondos, y, en este sentido, queremos subrayar que la gestión realizada desde el I3+ ha estado encaminada a lograr la operativización del fondo, como se ha venido solicitando desde el año 2020. ",
156,20,cgutmang,4.1,AUDITORÍA INTERNA      ,IEIE,Hallazgo por la desactualización de la caracterización del proceso,"No se evidencia actualización desde el año 2017 lo que indica que no se ha realizado la adopción del MIPG en la Universidad, el cual se realizó a partir del año 2019.",
157,20,cgutmang,5.1,AUDITORÍA INTERNA      ,IEIE,Hallazgo por la no actualización de los procedimientos,"Se evidencio que de los 18 procedimientos publicados, 17 se encuentran que como ultima fecha de actualizacion reportada es del año 2017. ",
158,20,cgutmang,6.1,AUDITORÍA INTERNA      ,IEIE,Hallazgo por la no publicación del plan de acción en la plataforma institucional,Se evidencia que el plan de acción no esta reportado en la plataforma Institucional,
159,20,cgutmang,7.1,AUDITORÍA INTERNA      ,IEIE,Hallazgo por la no publicación del organigrama en la plataforma institucional,No se pudo evidenciar en la plataforma institucional,
160,20,cgutmang,8.1,AUDITORÍA INTERNA      ,IEIE,Hallazgo por la no publicación de los informes de gestión en la plataforma institucional,No se pudo evidenciar en la plataforma institucional ,
